,Type,Text
3598,spam,Congratulations YOU'VE Won. You're a Winner in our August £1000 Prize Draw. Call 09066660100 NOW. Prize Code 2309.
465,ham,Ok i am on the way to railway
1952,ham,Haha... Really oh no... How? Then will they deduct your lesson tmr?
5030,spam,I'd like to tell you my deepest darkest fantasies. Call me 09094646631 just 60p/min. To stop texts call 08712460324 (nat rate)
368,spam,Here is your discount code RP176781. To stop further messages reply stop. www.regalportfolio.co.uk. Customer Services 08717205546
656,ham,Tell them the drug dealer's getting impatient
2631,ham,No way I'm going back there!
3604,ham,"I'm not sure, I was just checking out what was happening around the area"
2747,ham,K da:)how many page you want?
4687,ham,But pls dont play in others life.
1331,ham,"Aight no rush, I'll ask jay"
4650,ham,"Please protect yourself from e-threats. SIB never asks for sensitive information like Passwords,ATM/SMS PIN thru email. Never share your password with anybody."
2977,ham,I love u 2 my little pocy bell I am sorry but I love u
1290,ham,"Hey...Great deal...Farm tour 9am to 5pm $95/pax, $50 deposit by 16 May"
131,ham,I'm home.
1587,ham,There are no other charges after transfer charges and you can withdraw anyhow you like
4246,ham,Is toshiba portege m100 gd?
2894,ham,K I'll be sure to get up before noon and see what's what
5556,ham,Well keep in mind I've only got enough gas for one more round trip barring a sudden influx of cash
3696,ham,"Hello, As per request from  &lt;#&gt;  Rs.5 has been transfered to you"
3099,ham,This is all just creepy and crazy to me.
961,ham,U sure u can't take any sick time?
3725,spam,"Hi there, 2nights ur lucky night! Uve been invited 2 XCHAT, the Uks wildest chat! Txt CHAT to 86688 now! 150p/MsgrcvdHG/Suite342/2Lands/Row/W1J6HL LDN 18yrs"
3068,ham,Ok. So april. Cant wait
1470,ham,"7 wonders in My WORLD 7th You 6th Ur style 5th Ur smile 4th Ur Personality 3rd Ur Nature 2nd Ur SMS and 1st ""Ur Lovely Friendship""... good morning dear"
3443,spam,Save money on wedding lingerie at www.bridal.petticoatdreams.co.uk Choose from a superb selection with national delivery. Brought to you by WeddingFriend
511,ham,"8 at the latest, g's still there if you can scrounge up some ammo and want to give the new ak a try"
3418,ham,But i haf enuff space got like 4 mb...
5075,ham,I want to sent  &lt;#&gt; mesages today. Thats y. Sorry if i hurts
3822,ham,You are right though. I can't give you the space you want and need. This is really starting to become an issue. I was going to suggest setting a definite move out--if i'm still there-- after greece. But maybe you are ready and should do it now.
5125,ham,"Hi Chikku, send some nice msgs"
5002,ham,"Nope. Since ayo travelled, he has forgotten his guy"
1180,ham,To day class is there are no class.
218,ham,Easy ah?sen got selected means its good..
2270,ham,Haha i think i did too
5291,ham,Hey! Congrats 2u2. id luv 2 but ive had 2 go home!
5065,ham,I dunno lei... Like dun haf...
799,ham,Ok i msg u b4 i leave my house.
2024,ham,Is there any movie theatre i can go to and watch unlimited movies and just pay once?
3766,spam,"Someone U know has asked our dating service 2 contact you! Cant guess who? CALL 09058095107 NOW all will be revealed. POBox 7, S3XY 150p"
3650,ham,Hmm ill have to think about it... ok you're forgiven! =D
5183,ham,K sure am in my relatives home. Sms me de. Pls:-)
859,ham,Spoons it is then okay?
2765,ham,"Open rebtel with firefox. When it loads just put plus sign in the user name place, and it will show you two numbers. The lower number is my number. Once you pick that number the pin will display okay!"
2891,ham,Shuhui has bought ron's present it's a swatch watch...
4468,ham,"She said,'' do u mind if I go into the bedroom for a minute ? '' ''OK'', I sed in a sexy mood. She came out 5 minuts latr wid a cake...n My Wife,"
1004,ham,&lt;#&gt;  am I think? Should say on syllabus
342,ham,I take it the post has come then! You must have 1000s of texts now! Happy reading. My one from wiv hello caroline at the end is my favourite. Bless him
40,ham,Pls go ahead with watts. I just wanted to be sure. Do have a great weekend. Abiola
1981,ham,"Sorry, I'll call later"
1546,ham,"Good afternoon, my love ! Any job prospects ? Are you missing me ? What do you do ? Are you being lazy and bleak, hmmm ? Or happy and filled with my love ?"
3751,ham,"Buzz! Hey, my Love ! I think of you and hope your day goes well. Did you sleep in ? I miss you babe. I long for the moment we are together again*loving smile*"
5222,ham,I have to take exam with in march 3
456,ham,Si si. I think ill go make those oreo truffles.
1862,ham,Aiyah then i wait lor. Then u entertain me. Hee...
1598,spam,URGENT! Your Mobile number has been awarded with a £2000 prize GUARANTEED. Call 09061790121 from land line. Claim 3030. Valid 12hrs only 150ppm
4145,ham,That's a shame! Maybe cld meet for few hrs tomo?
1048,spam,"1000's flirting NOW! Txt GIRL or BLOKE & ur NAME & AGE, eg GIRL ZOE 18 to 8007 to join and get chatting!"
1796,ham,"I hope your alright babe? I worry that you might have felt a bit desparate when you learned the job was a fake ? I am here waiting when you come back, my love"
1756,ham,Really good:)dhanush rocks once again:)
1090,ham,Goodmorning today i am late for  &lt;DECIMAL&gt; min.
3405,ham,Then ü ask dad to pick ü up lar... Ü wan 2 stay until 6 meh...
95,spam,"Your free ringtone is waiting to be collected. Simply text the password ""MIX"" to 85069 to verify. Get Usher and Britney. FML, PO Box 5249, MK17 92H. 450Ppw 16"
129,ham,HEY GIRL. HOW R U? HOPE U R WELL ME AN DEL R BAK! AGAIN LONG TIME NO C! GIVE ME A CALL SUM TIME FROM LUCYxx
34,spam,Thanks for your subscription to Ringtone UK your mobile will be charged £5/month Please confirm by replying YES or NO. If you reply NO you will not be charged
3134,ham,So no messages. Had food?
2812,ham,Thinkin about someone is all good. No drugs for that
4609,ham,We live in the next  &lt;#&gt; mins
1316,ham,"Whenevr ur sad, Whenevr ur gray, Remembr im here 2 listn 2 watevr u wanna say, Jus walk wid me a little while,&amp; I promise I'll bring back ur smile.:-)"
217,ham,Tired. I haven't slept well the past few nights.
3890,ham,Unlimited texts. Limited minutes.
1795,ham,How much i gave to you. Morning.
2885,ham,Cbe is really good nowadays:)lot of shop and showrooms:)city is shaping good.
1664,ham,S but mostly not like that.
4012,spam,Please call our customer service representative on FREEPHONE 0808 145 4742 between 9am-11pm as you have WON a guaranteed £1000 cash or £5000 prize!
739,ham,Wish i were with you now!
3764,ham,K.i will send in  &lt;#&gt;  min:)
2911,ham,How do you guys go to see movies on your side.
2271,ham,U know we watchin at lido?
249,ham,It didnt work again oh. Ok goodnight then. I.ll fix and have it ready by the time you wake up. You are very dearly missed have a good night sleep.
3871,ham,Oh ok wait 4 me there... My lect havent finish
2054,ham,"Oh... I was thkin of goin yogasana at 10 den no nd to go at 3 den can rush to parco 4 nb... Okie lor, u call me when ready..."
2672,ham,"That's cool, I'll come by like  &lt;#&gt; ish"
5108,ham,Ding me on ya break fassyole! Blacko from londn
146,ham,Whats the staff name who is taking class for us?
5272,ham,Did u fix the teeth?if not do it asap.ok take care.
100,ham,Please don't text me anymore. I have nothing else to say.
1108,ham,From someone not to smoke when every time I've smoked in the last two weeks is because of you calling or texting me that you wanted to smoke
297,ham,Unless it's a situation where YOU GO GURL would be more appropriate
3215,ham,"Babe, have you got enough money to pick up bread and milk ? And I'll give you it back when you get home ?"
3926,ham,As if i wasn't having enough trouble sleeping.
2269,spam,88066 FROM 88066 LOST 3POUND HELP
3004,ham,I will see in half an hour
2820,ham,Don't forget who owns you and who's private property you are ... And be my good boy always .. *passionate kiss*
948,ham,Hey i booked the kb on sat already... what other lessons are we going for ah? Keep your sat night free we need to meet and confirm our lodging
3269,ham,Which is why i never wanted to tell you any of this. Which is why i'm so short with you and on-edge as of late.
5565,ham,Ard 6 like dat lor.
3350,ham,Oh is it! Which brand?
2777,ham,Send me your id and password
29,ham,Ahhh. Work. I vaguely remember that! What does it feel like? Lol
5512,ham,I went to project centre
4288,ham,I wud never mind if u dont miss me or if u dont need me.. But u wil really hurt me wen u need me &amp; u dont tell me......... Take care:-)
4752,spam,Your weekly Cool-Mob tones are ready to download !This weeks new Tones include: 1) Crazy Frog-AXEL F>>> 2) Akon-Lonely>>> 3) Black Eyed-Dont P >>>More info in n
5441,ham,Hey i've booked the 2 lessons on sun liao...
1808,ham,Do have a nice day today. I love you so dearly.
867,ham,"Same here, but I consider walls and bunkers and shit important just because I never play on peaceful but I guess your place is high enough that it don't matter"
2575,spam,Your next amazing xxx PICSFREE1 video will be sent to you enjoy! If one vid is not enough for 2day text back the keyword PICSFREE1 to get the next video.
1457,ham,U sleeping now.. Or you going to take? Haha.. I got spys wat.. Me online checking n replying mails lor..
3946,ham,I will be gentle princess! We will make sweet gentle love...
4079,ham,Gam gone after outstanding innings.
5394,ham,Ooooooh I forgot to tell u I can get on yoville on my phone
2395,ham,I don't run away frm u... I walk slowly &amp; it kills me that u don't care enough to stop me...
4591,ham,Tomorrow i am not going to theatre. . . So i can come wherever u call me. . . Tell me where and when to come tomorrow
4395,ham,Baaaaaaaabe! Wake up ! I miss you ! I crave you! I need you!
3362,ham,You only hate me. You can call any but you didnt accept even a single call of mine. Or even you messaged
497,ham,Nope... Think i will go for it on monday... Sorry i replied so late
805,ham,K I'll be there before 4.
3369,ham,"Hey elaine, is today's meeting still on?"
356,ham,"Thank You for calling.Forgot to say Happy Onam to you Sirji.I am fine here and remembered you when i met an insurance person.Meet You in Qatar Insha Allah.Rakhesh, ex Tata AIG who joined TISSCO,Tayseer."
631,ham,Please dont say like that. Hi hi hi
2152,ham,I surely dont forgot to come:)i will always be in touch in with you:-)
4902,ham,Taka lor. Wat time u wan 2 come n look 4 us?
1538,ham,All sounds good. Fingers . Makes it difficult to type
1033,ham,HAPPY NEW YEAR MY NO.1 MAN
3689,ham,I'll meet you in the lobby
3934,ham,"Playin space poker, u?"
56,spam,"Congrats! 1 year special cinema pass for 2 is yours. call 09061209465 now! C Suprman V, Matrix3, StarWars3, etc all 4 FREE! bx420-ip4-5we. 150pm. Dont miss out!"
1823,ham,If you're thinking of lifting me one then no.
1649,ham,If u laugh really loud.. If u talk spontaneously.. If u dont care what others feel.. U are probably with your dear &amp; best friends.. GOODEVENING Dear..:)
1604,ham,Have you heard about that job? I'm going to that wildlife talk again tonight if u want2come. Its that2worzels and a wizzle or whatever it is?!
1330,ham,I dont know what to do to come out of this so only am ask questions like this dont mistake me.
4308,ham,I guess it is useless calling u 4 something important.
2543,ham,Aiyo please ü got time meh.
3049,ham,Die... Now i have e toot fringe again...
153,ham,Ok... Ur typical reply...
4392,ham,The greatest test of courage on earth is to bear defeat without losing heart....gn tc
73,ham,K..k:)where are you?how did you performed?
643,ham,Probably gonna swing by in a wee bit
5016,ham,I think the other two still need to get cash but we can def be ready by 9
4348,spam,U 447801259231 have a secret admirer who is looking 2 make contact with U-find out who they R*reveal who thinks UR so special-call on 09058094597
1994,ham,Eh den sat u book e kb liao huh...
2646,ham,"Sorry, I'll call later"
4970,ham,I will cme i want to go to hos 2morow. After that i wil cme. This what i got from her dear what to do. She didnt say any time
2917,ham,What time should I tell my friend to be around?
2183,ham,PS U no ur a grown up now right?
301,ham,"Awesome, I remember the last time we got somebody high for the first time with diesel :V"
1995,ham,Have you been practising your curtsey?
1125,ham,Aiyar sorry lor forgot 2 tell u...
2195,ham,Hi my email address has changed now it is
4539,ham,Dare i ask... Any luck with sorting out the car?
923,ham,It shall be fine. I have avalarr now. Will hollalater
829,ham,"Sorry light turned green, I meant another friend wanted  &lt;#&gt;  worth but he may not be around"
5069,ham,Talk to g and x about that
1250,ham,"I call you later, don't have network. If urgnt, sms me."
250,spam,Congratulations ur awarded 500 of CD vouchers or 125gift guaranteed & Free entry 2 100 wkly draw txt MUSIC to 87066 TnCs www.Ldew.com1win150ppmx3age16
4261,ham,Are you plans with your family set in stone ?
4335,ham,Boo what time u get out? U were supposed to take me shopping today. :(
1260,ham,"We have sent JD for Customer Service cum Accounts Executive to ur mail id, For details contact us"
2796,ham,How will I creep on you now? ;_;
4000,ham,K...k...when will you give treat?
1136,ham,K do I need a login or anything
5314,ham,Here got ur favorite oyster... N got my favorite sashimi... Ok lar i dun say already... Wait ur stomach start rumbling...
1379,ham,"Ya tel, wats ur problem.."
3606,ham,Jordan got voted out last nite!
3173,ham,Do u still have plumbers tape and a wrench we could borrow?
989,ham,"Yun ah.the ubi one say if ü wan call by tomorrow.call 67441233 look for irene.ere only got bus8,22,65,61,66,382. Ubi cres,ubi tech park.6ph for 1st 5wkg days.èn"
3495,spam,"You are being contacted by our dating service by someone you know! To find out who it is, call from a land line 09050000878. PoBox45W2TG150P"
3856,spam,Free msg: Single? Find a partner in your area! 1000s of real people are waiting to chat now!Send CHAT to 62220Cncl send STOPCS 08717890890£1.50 per msg
4469,ham,Much better now thanks lol
747,ham,"I promise to take good care of you, princess. I have to run now. Please send pics when you get a chance. Ttyl!"
3630,ham,Should I head straight there or what
366,ham,Well i know Z will take care of me. So no worries.
5309,ham,What you did in  leave.
3231,ham,"I feel like a dick because I keep sleeping through your texts and facebook messages. Sup, you in town?"
3896,ham,Yes. Last  practice
4478,ham,Oh :-)only 4 outside players allowed to play know
1291,ham,Eat jap done oso aft ur lect wat... Ü got lect at 12 rite...
2470,ham,* Am on my way
5203,spam,"YOU VE WON! Your 4* Costa Del Sol Holiday or £5000 await collection. Call 09050090044 Now toClaim. SAE, TC s, POBox334, Stockport, SK38xh, Cost£1.50/pm, Max10mins"
3047,ham,So how's the weather over there?
1522,ham,Are you angry with me. What happen dear
3955,ham,I probably won't eat at all today. I think I'm gonna pop. How was your weekend? Did u miss me?
1277,ham,Can do lor...
39,ham,Hello! How's you and how did saturday go? I was just texting to see if you'd decided to do anything tomo. Not that i'm trying to invite myself or anything!
4883,ham,As usual u can call me ard 10 smth.
3802,ham,"It's ok, at least armand's still around"
3628,ham,Still chance there. If you search hard you will get it..let have a try :)
496,ham,Got meh... When?
5372,spam,dating:i have had two of these. Only started after i sent a text to talk sport radio last week. Any connection do you think or coincidence?
1101,ham,You busy or can I come by at some point and figure out what we're doing tomorrow
4724,ham,HELLO PEACH! MY CAKE TASTS LUSH!
450,ham,10 min later k...
5401,ham,And he's apparently bffs with carly quick now
933,ham,So do you have samus shoulders yet
863,ham,"Sorry, I guess whenever I can get a hold of my connections, maybe an hour or two? I'll text you"
240,spam,U 447801259231 have a secret admirer who is looking 2 make contact with U-find out who they R*reveal who thinks UR so special-call on 09058094597
1462,ham,Kinda. First one gets in at twelve! Aah. Speak tomo
5281,ham,"Helloooo... Wake up..! ""Sweet"" ""morning"" ""welcomes"" ""You"" ""Enjoy"" ""This Day"" ""with full of joy"".. ""GUD MRNG""."
365,ham,"Good afternoon sunshine! How dawns that day ? Are we refreshed and happy to be alive? Do we breathe in the air and smile ? I think of you, my love ... As always"
2252,ham,hope things went well at 'doctors' ;) reminds me i still need 2go.did u c d little thing i left in the lounge?
2584,ham,"Goodmorning, today i am late for 1hr."
3310,ham,Okie ü wan meet at bishan? Cos me at bishan now. I'm not driving today.
1193,ham,I was up all night too worrying about this appt. It's a shame we missed a girls night out with quizzes popcorn and you doing my hair.
3704,ham,"How is my boy? No sweet words left for me this morning ... *sighs* ... How goes you day, my love ? Did you start your studying?"
3236,ham,"Yes, princess. Toledo."
58,ham,Tell where you reached
2871,spam,"YOUR CHANCE TO BE ON A REALITY FANTASY SHOW call now = 08707509020 Just 20p per min NTT Ltd, PO Box 1327 Croydon CR9 5WB 0870 is a national = rate call."
1876,spam,HMV BONUS SPECIAL 500 pounds of genuine HMV vouchers to be won. Just answer 4 easy questions. Play Now! Send HMV to 86688 More info:www.100percent-real.com
3419,spam,LIFE has never been this much fun and great until you came in. You made it truly special for me. I won't forget you! enjoy @ one gbp/sms
449,ham,LOL ... Have you made plans for new years?
196,ham,Gud mrng dear hav a nice day
1301,ham,Those cocksuckers. If it makes you feel better ipads are worthless garbage novelty items and you should feel bad for even wanting one
1352,ham,Yo theres no class tmrw right?
3104,ham,"U so lousy, run already come back then half dead... Hee..."
3675,spam,You have won a Nokia 7250i. This is what you get when you win our FREE auction. To take part send Nokia to 86021 now. HG/Suite342/2Lands Row/W1JHL 16+
4094,ham,"""Life is nothing wen v get everything"". But ""life is everything wen v miss something "". Real value of people wil be realized only in their absence.... gud mrng"
4871,ham,Dip's cell dead. So i m coming with him. U better respond else we shall come back.
3432,ham,Yeah if we do have to get a random dude we need to change our info sheets to PARTY  &lt;#&gt; /7 NEVER STUDY just to be safe
3938,ham,"Yeah, in fact he just asked if we needed anything like an hour ago. When and how much?"
1769,ham,How. Its a little difficult but its a simple way to enter this place
1847,ham,Its on in engalnd! But telly has decided it won't let me watch it and mia and elliot were kissing! Damn it!
4675,ham,I'm leaving my house now.
2953,ham,Tell me whos this pls:-)
3382,spam,"complimentary 4 STAR Ibiza Holiday or £10,000 cash needs your URGENT collection. 09066364349 NOW from Landline not to lose out! Box434SK38WP150PPM18+"
5074,ham,Gud ni8 dear..slp well..take care..swt dreams..Muah..
3302,spam,RCT' THNQ Adrian for U text. Rgds Vatian
1255,ham,What your plan for pongal?
5403,ham,Babes I think I got ur brolly I left it in English wil bring it in 2mrw 4 u luv Franxx
4438,ham,How come u got nothing to do?
580,ham,"Arngd marriage is while u r walkin unfortuntly a snake bites u. bt love marriage is dancing in frnt of d snake &amp; sayin Bite me, bite me."
2187,ham,So is there anything specific I should be doing with regards to jaklin or what because idk what the fuck
2151,ham,"The table's occupied, I'm waiting by the tree"
835,ham,Surely result will offer:)
2411,ham,Ok... Thanx... Gd nite 2 ü too...
3895,spam,Dear Dave this is your final notice to collect your 4* Tenerife Holiday or #5000 CASH award! Call 09061743806 from landline. TCs SAE Box326 CW25WX 150ppm
671,ham,Ho ho - big belly laugh! See ya tomo
2381,ham,"If i let you do this, i want you in the house by 8am."
4155,ham,Haf u eaten? Wat time u wan me 2 come?
3111,spam,Good Luck! Draw takes place 28th Feb 06. Good Luck! For removal send STOP to 87239 customer services 08708034412
1337,ham,"Sweet, we may or may not go to 4U to meet carlos so gauge patty's interest in that"
1436,ham,Dad went out oredi...
5464,spam,Txt: CALL to No: 86888 & claim your reward of 3 hours talk time to use from your phone now! Subscribe6GBP/mnth inc 3hrs 16 stop?txtStop www.gamb.tv
3582,ham,Ard 4 lor...
789,spam,"5 Free Top Polyphonic Tones call 087018728737, National Rate. Get a toppoly tune sent every week, just text SUBPOLY to 81618, £3 per pole. UnSub 08718727870."
1805,ham,The bus leaves at  &lt;#&gt;
4073,spam,Loans for any purpose even if you have Bad Credit! Tenants Welcome. Call NoWorriesLoans.com on 08717111821
1288,ham,"What do you do, my dog ? Must I always wait till the end of your day to have word from you ? Did you run out of time on your cell already?"
3653,ham,"Probably not, still going over some stuff here"
2221,ham,But really quite funny lor wat... Then u shd haf run shorter distance wat...
5354,ham,Good morning princess! Have a great day!
546,ham,Then any special there?
3825,ham,I miss you so much I'm so desparate I have recorded the message you left for me the other day and listen to it just to hear the sound of your voice. I love you
1491,ham,"Cant believe i said so many things to you this morning when all i really wanted to say was good morning, i love you! Have a beautiful morning. See you in the library later."
3548,spam,"Rock yr chik. Get 100's of filthy films &XXX pics on yr phone now. rply FILTH to 69669. Saristar Ltd, E14 9YT 08701752560. 450p per 5 days. Stop2 cancel"
5038,ham,(You didn't hear it from me)
4617,ham,Ü called dad oredi...
252,ham,"Wen ur lovable bcums angry wid u, dnt take it seriously.. Coz being angry is d most childish n true way of showing deep affection, care n luv!.. kettoda manda... Have nice day da."
2972,ham,"Height of Confidence: All the Aeronautics professors wer calld &amp; they wer askd 2 sit in an aeroplane. Aftr they sat they wer told dat the plane ws made by their students. Dey all hurried out of d plane.. Bt only 1 didnt move... He said:""if it is made by my students,this wont even start........ Datz confidence.."
3288,ham,"The gas station is like a block away from my house, you'll drive right by it since armenia ends at swann and you have to take howard"
4912,ham,Love that holiday Monday feeling even if I have to go to the dentists in an hour
2008,ham,Hi here. have birth at on the  to  at 8lb 7oz. Mother and baby doing brilliantly.
4257,ham,Aah! A cuddle would be lush! I'd need lots of tea and soup before any kind of fumbling!
5534,ham,happened here while you were adventuring
3984,ham,Nationwide auto centre (or something like that) on Newport road. I liked them there
5228,ham,Prabha..i'm soryda..realy..frm heart i'm sory
2438,spam,"For ur chance to win £250 cash every wk TXT: PLAY to 83370. T's&C's www.music-trivia.net custcare 08715705022, 1x150p/wk."
4074,ham,Was the actual exam harder than NBME
2781,ham,Long after I quit. I get on only like 5 minutes a day as it is.
3140,ham,Is ur lecture over?
3328,ham, what number do u live at? Is it 11?
3640,ham,Wat's da model num of ur phone?
882,ham,"see, i knew giving you a break a few times woul lead to you always wanting to miss curfew. I was gonna gibe you 'til one, but a MIDNIGHT movie is not gonna get out til after 2. You need to come home. You need to getsleep and, if anything, you need to b studdying ear training."
3347,ham,U're welcome... Caught u using broken english again...
4796,ham,Saw Guys and Dolls last night with Patrick Swayze it was great
245,ham,U don't remember that old commercial?
4218,ham,Will be office around 4 pm. Now i am going hospital.
623,ham,MAKE SURE ALEX KNOWS HIS BIRTHDAY IS OVER IN FIFTEEN MINUTES AS FAR AS YOU'RE CONCERNED
174,ham,"Bloody hell, cant believe you forgot my surname Mr . Ill give u a clue, its spanish and begins with m..."
1168,ham,Lol now I'm after that hot air balloon!
5351,ham,I'm home...
3367,ham,I am waiting for your call sir.
3961,ham,I sent lanre fakeye's Eckankar details to the mail box
1709,ham,"How's my loverboy doing ? What does he do that keeps him from coming to his Queen, hmmm ? Doesn't he ache to speak to me ? Miss me desparately ?"
4417,ham,V skint too but fancied few bevies.waz gona go meet &othrs in spoon but jst bin watchng planet earth&sofa is v comfey; If i dont make it hav gd night
553,ham,"Sure, if I get an acknowledgement from you that it's astoundingly tactless and generally faggy to demand a blood oath fo"
999,ham,Then ü wait 4 me at bus stop aft ur lect lar. If i dun c ü then i go get my car then come back n pick ü.
1904,spam,Free entry in 2 a weekly comp for a chance to win an ipod. Txt POD to 80182 to get entry (std txt rate) T&C's apply 08452810073 for details 18+
2661,ham,Want to finally have lunch today?
3287,ham,Not to worry. I'm sure you'll get it.
4880,ham,Yeah just open chat and click friend lists. Then make the list. Easy as pie
4615,ham,hows my favourite person today? r u workin hard? couldn't sleep again last nite nearly rang u at 4.30
2113,spam,You are a winner you have been specially selected to receive £1000 cash or a £2000 award. Speak to a live operator to claim call 087123002209am-7pm. Cost 10p
2914,ham,Kindly send some one to our flat before  &lt;DECIMAL&gt;  today.
4112,spam,URGENT! Your Mobile number has been awarded a <UKP>2000 prize GUARANTEED. Call 09061790125 from landline. Claim 3030. Valid 12hrs only 150ppm
2166,ham,I'm not coming home 4 dinner.
3444,ham,Your board is working fine. The issue of overheating is also reslove. But still software inst is pending. I will come around 8'o clock.
3079,ham,Okay but i thought you were the expert
4705,ham,Yar but they say got some error.
2502,ham,No da..today also i forgot..
2683,ham,I got a call from a landline number. . . I am asked to come to anna nagar . . . I will go in the afternoon
